{
  "sample_selection": [
    "2006 <= year <= 2016",
    "year != 2012",
    "hispan == 1",
    "bpl == 200",
    "citizen in {3, 4, 5}",
    "15 <= age2012 <= 39"
  ],
  "outcome_definition": "uhrswork >= 35",
  "treatment_definition": "((age2012 >= 15) & (age2012 <= 30) & (year >= 2013))",
  "model_specification_line": "result = smf.wls(\"full_time ~ daca_treated + C(age2012) + C(year) + C(statefip) + lfpr + unemp\", data=df, weights=df[\"perwt\"]).fit(cov_type=\"cluster\", cov_kwds={\"groups\": df[\"statefip\"]})"
}