{
  "model_specification_line": "result = sm.OLS(df['full_time'], sm.add_constant(df[['eligible']], has_constant='add')).fit()",
  "outcome_definition": "full_time",
  "sample_selection": [
    "year >= 2013 and year <= 2016",
    "hispan == 1",
    "bpl == 200",
    "birthyr >= 1981",
    "yrimmig >= 2003 and yrimmig <= 2012"
  ],
  "treatment_definition": "eligible"
}