{
  "sample_selection": [
    "2006 <= year <= 2016",
    "year != 2012",
    "hispan == 1",
    "bpl == 200",
    "citizen in [3, 4]",
    "empstat in [1, 2, 3]",
    "0 < yrimmig <= 2007",
    "1978 <= birthyr <= 1986",
    "yrimmig - birthyr <= 15"
  ],
  "outcome_definition": "((empstat == 1) & (uhrswork >= 35)).astype(float)",
  "treatment_definition": "(birthyr >= 1982).astype(float)",
  "model_specification_line": "model = smf.wls(\"full_time ~ C(birthyr) + C(year) + C(statefip) + C(sex) + daca_post + DRIVERSLICENSES + INSTATETUITION + STATEFINANCIALAID + HIGHEREDBAN + EVERIFY + LIMITEVERIFY + OMNIBUS + TASK287G + JAIL287G + SECURECOMMUNITIES + LFPR + UNEMP\", data=sample, weights=sample['perwt']).fit(cov_type='cluster', cov_kwds={'groups': sample['statefip']})"
}