{
  "sample_selection": [
    "HISPAN == 1",
    "BPL == 200",
    "AGE >= 15",
    "AGE <= 30",
    "YRIMMIG <= 2007",
    "YRIMMIG >= 2000",
    "CITIZEN == 3",
    "YEAR >= 2013",
    "YEAR <= 2016"
  ],
  "outcome_definition": "(EMPSTAT == 1) & (UHRSWORK >= 35)",
  "treatment_definition": "(AGE >= 15) & (AGE <= 30) & (YRIMMIG <= 2007) & (YRIMMIG >= 2000) & (YEAR >= 2013)",
  "model_specification_line": "model = DiffInDiffRegressor(att_int='doubly_robust', n_boot=100)"
}