{
  "model_specification_line": "beta = np.linalg.solve(xtwx, xtwy)",
  "outcome_definition": "full_time = uhrswork >= 35",
  "sample_selection": [
    "year between 2013 and 2016",
    "hispan == 1",
    "hispand in {100, 102, 103, 104, 105, 106, 107}",
    "birthplace (bpl) == Mexico (200)",
    "citizen in {3, 4, 5}",
    "birth year between 1982 and 1996",
    "year of immigration between 1900 and 2012",
    "arrival age between 0 and 30"
  ],
  "treatment_definition": "eligible = (yrimmig <= 2007) & (arrival_age <= 15)"
}