{
  "model_specification_line": "res = smf.wls(formula='fulltime ~ post_x_elig + eligible + C(year) + C(statefip) + age + I(age**2) + C(sex)', data=df, weights=df['perwt']).fit(cov_type='HC1')",
  "outcome_definition": "(df['empstat'] == 1) & (df['uhrswork'] >= 35)",
  "sample_selection": [
    "hispan == 1 (Hispanic of Mexican origin)",
    "bpl == 200 (born in Mexico)",
    "citizen == 3 (non-citizen; proxy for undocumented status)",
    "yrimmig > 0 and yrimmig <= 2007 (immigrated by 2007, satisfying 5-year US residence requirement)",
    "yrimmig - birthyr < 16 (arrived before 16th birthday)",
    "year in [2009, 2010, 2011, 2013, 2014, 2015, 2016] (pre/post window; 2012 dropped as DACA transition year)",
    "birthyr >= 1972 and birthyr <= 1996 (covers control cohort 1972-1981 and treated cohort 1982-1996)",
    "age >= 18 and age <= 40 (working-age adults)"
  ],
  "treatment_definition": "(df['birthyr'] >= 1982).astype('int8')"
}