{
  "model_specification_line": "result = smf.wls(\"full_time ~ eligible * post + age + I(age ** 2) + C(sex) + C(year) + C(statefip)\", data=df, weights=df[\"perwt\"]).fit(cov_type=\"HC1\")",
  "outcome_definition": "((empstat == 1) & (uhrswork >= 35)).astype(int)",
  "sample_selection": [
    "2006 <= year <= 2016 and year != 2012",
    "hispan == 1",
    "bpl == 200",
    "citizen == 3",
    "18 <= age <= 40",
    "perwt > 0",
    "0 <= uhrswork <= 98",
    "yrimmig > 0 and yrimmig <= 2007 and yrimmig <= year"
  ],
  "treatment_definition": "(((birthyr > 1981) | ((birthyr == 1981) & (birthqtr >= 3))) & (yrimmig <= 2007) & ((yrimmig - birthyr) < 16)).astype(int)"
}