{
  "model_specification_line": "result = smf.wls(\"full_time ~ DACA_eligible + birthyr_centered + I(birthyr_centered ** 2) + C(year) + C(statefip) + UNEMP + LFPR + DRIVERSLICENSES + INSTATETUITION + STATEFINANCIALAID + HIGHEREDBAN + EVERIFY + LIMITEVERIFY + OMNIBUS + TASK287G + JAIL287G\", data=df, weights=df[\"perwt\"]).fit(cov_type=\"HC1\")",
  "outcome_definition": "full_time = ((empstat == 1) & (uhrswork >= 35)).astype(int)",
  "sample_selection": [
    "year between 2013 and 2016 inclusive",
    "hispan == 1 (Mexican origin)",
    "bpl == 200 (born in Mexico)",
    "citizen == 3 (not a citizen)",
    "yrimmig > 0 and yrimmig <= 2007 and yrimmig <= birthyr + 15",
    "age between 16 and 64",
    "birthyr between 1972 and 2002",
    "perwt > 0"
  ],
  "treatment_definition": "DACA_eligible = ((birthyr >= 1982) & (birthyr <= 1997)).astype(int)"
}