{
  "model_specification_line": "result = smf.wls(\"full_time ~ DACA_eligible + C(year) + C(statefip)\", data=df, weights=df[\"perwt\"]).fit(cov_type=\"HC1\")",
  "outcome_definition": "full_time = ((empstat == 1) & (uhrswork >= 35)).astype(int)",
  "sample_selection": [
    "year between 2013 and 2016",
    "hispan == 1",
    "bpl == 200 (Mexico)",
    "citizen in {2,3}",
    "yrimmig > 0 and yrimmig <= 2007 and yrimmig <= birthyr + 15",
    "perwt > 0",
    "age between 16 and 64",
    "birthyr between 1972 and 2002"
  ],
  "treatment_definition": "DACA_eligible = birthyr.between(1982, 1997).astype(int)"
}