{
  "model_specification_line": "model = smf.wls(\"full_time ~ eligible + eligible:post + C(age) + C(statefip) + C(year) + lfpr + unemp\", data=model_df, weights=model_df[\"perwt\"]).fit(cov_type=\"cluster\", cov_kwds={\"groups\": model_df[\"statefip\"]})",
  "outcome_definition": "((empstat == 1) & (uhrswork >= 35)).astype(int)",
  "sample_selection": [
    "2006 <= year <= 2016",
    "year != 2012",
    "hispan == 1",
    "bpl == 200",
    "citizen == 3",
    "15 <= age <= 40",
    "yrimmig > 0",
    "yrimmig <= 2007",
    "birthyr <= 1997",
    "0 <= yrimmig - birthyr <= 15",
    "empstat in {1, 2, 3}"
  ],
  "treatment_definition": "((birthyr >= 1982) & (birthyr <= 1997) & (yrimmig <= 2007) & ((yrimmig - birthyr) <= 15)).astype(int)"
}